Id;CreationDate;PostId;Score;Text;UserId
1904427;2010-01-01 00:00:50.027;1987105;0;Be aware that `eval` has security implications: http://mywiki.wooledge.org/BashFAQ/048;26428
1904431;2010-01-01 00:02:46.280;1981242;0;As an example, my firefox 3.5.6 has a Go Daddy intermediate cert but not the rapidssl intermediate cert.;238704
1904434;2010-01-01 00:04:58.833;1980771;0;Hmmm, I don't see the rapidssl ca at that apple.com link;238704
1904436;2010-01-01 00:06:14.540;1987485;0;Hmm, some languages allow the inference to be after the point of var declaration...;84535
1904437;2010-01-01 00:06:18.223;1976193;0;"Hmm...maybe you can look at the test page directly:  http://ppgeez.com/stats/enter_game.php

Basically, there is one main table, and then inside each of that tables TD's contains 2 nested tables.  The radio boxes are in a table themselves, and the checkbox and N/A radio button are in another.  Thats why, when I turn OFF the highlighting, I had to find the 0th parent, instead of the 1st parent like I use to turn it on.  Check it out... if you can update your code so I can see how its done, that would be great.  Thanks.";240350
1904438;2010-01-01 00:07:28.233;841201;0;I'd love to see syntax like this in more languages, like C#.;12971
1904440;2010-01-01 00:08:19.310;1987512;4;Specifically, the optional `DocumentType` node is a `childNode` of `Document`, just as the root `documentElement` and any `Comment` nodes outside the root are.;18936
1904441;2010-01-01 00:08:28.780;1978064;0;That's too bad. Good luck discovering the source of your problem.;165876
1904442;2010-01-01 00:08:37.267;1987520;0;The doesn't seem anything related to php. It's like windows is encoding to ANSI when I save it with this code. At least this is the conclusion I am getting at;8715
1904444;2010-01-01 00:10:31.023;1986709;0;Nicely put, a House class would really tie the rooms together.;241676
1904447;2010-01-01 00:11:31.613;1987543;1;"You can also use the ""simplified"" databinding syntax of ASP.NET 2.0 and newer: <%# Eval(""videoFile"") %>";31668
1904448;2010-01-01 00:12:06.103;1986571;0;In that case dynamic linq may help, but you may need a two-pass approach. Parse the data once to see which tags are encountered, and then another time to fill the list of new objects. I guess the problem is that if any mp3 file has a defined property, after you map the values to objects (dynamic or not) all of them have to have that property.;175823
1904449;2010-01-01 00:12:24.043;1987183;0;"Pseudocode is on page 121 of that book. Note that the algorithm given there is a little different; it's guaranteed to terminate but may fail to find a solution even if one exists. It's only ""almost certain"" to find the solution, and then only if the graph has a lot of edges! By contrast, the algorithm as described by Wikipedia will wander forever if no Hamiltonian path exists. Hey, what can you expect of an O(n^2) algorithm for an NP-complete problem?";94977
1904450;2010-01-01 00:12:37.477;1987485;0;It would surprise me if C# doesn't get more clever about type inference at some point.  As long as all assignments in the current scope attempt to assign the same time, a compiler can handle this situation.;141172
1904451;2010-01-01 00:13:46.413;1987514;0;"Yes - did ""Clean all targets"", deleted ""Build"" folder";241762
1904452;2010-01-01 00:13:59.673;1987325;0;I've updated my response to include a C# program that prints out all the values.;31668
1904453;2010-01-01 00:14:03.200;1984871;3;"I dropped Perl and moved to Python, not because of speed concerns but language concerns. Python is a joy to program in; Perl gives me sorrow.";60075
1904455;2010-01-01 00:16:37.203;1987213;0;You'll want to take a look at the NSConnection class, and its related classes (NSURL, NSURLConnection, etc).;6694
1904457;2010-01-01 00:17:14.707;1987520;0;"Okay, now you lost me. What exactly *are* you asking about? The encoding detected by some editor? If there are no ""high"" characters in the file, then it may very well be detected as ISO-8859-1, since BOMless UTF-8 (PHP wants it without a BOM, so...) with no characters >=128 will differ in their binary representation from the ISO-8859-1 representation.";27528
1904458;2010-01-01 00:18:03.550;1985083;0;"""Python local vars are much faster than globals."" Interesting. Do you have a good reference to explain this? How about class instance variables—are they faster than globals too?";60075
1904459;2010-01-01 00:18:09.837;1987221;0;there is no link to click. i added what i can see above;108869
1904460;2010-01-01 00:18:56.033;1987554;14;"Usually it means they want gullible kids who are willing to work for equity stakes and ""experience"" in lieu of competitive pay.";187712
1904461;2010-01-01 00:19:16.127;1987553;0;Maybe if you explained what that meant - there aren't many people here that do both .net and java.;21234
1904462;2010-01-01 00:19:24.767;1987554;12;Ask them, not us.;NULL
1904463;2010-01-01 00:19:25.730;1987468;0;"You will eventually want to use something specific instead of coupling this to the logger, such as opt[""time_functions""] (which you might default to True/False based on some other option).";NULL
1904464;2010-01-01 00:20:02.297;1987512;0;Thank you, Alex.  bobince, the comment you left is also very informative.;241761
1904466;2010-01-01 00:20:50.877;1987557;0;Thanks, I don't know why I didn't look at the samples first. :-);105500
1904468;2010-01-01 00:21:37.863;1987495;0;It may.  Does it?;17034
1904469;2010-01-01 00:21:53.493;1986908;0;If it's closed as moved, there will be a link here which you can follow to superuser.com where other people may add answers.;26428
1904470;2010-01-01 00:21:54.227;1987460;0;The question wasn't clear, but I interpreted it as a character array non-static data member, for which this answer wouldn't apply.;NULL
1904471;2010-01-01 00:21:56.693;1987024;0;Change the '*' metacharacter to a '+' so that the URL has at least one character in the path. Answer updated.;90527
1904472;2010-01-01 00:22:02.690;1984660;0;No shared group was needed, I don’t even know what that is.;17279
1904473;2010-01-01 00:23:16.347;1970966;0;Thanks - so then this could also be a useful function to get different screen states together with a timer function to show the application in various states for documentation purposes?;239721
1904474;2010-01-01 00:23:16.470;1987183;0;@Kevin Montrose: The algorithm relies on being able to pivot, which reverses part of the path. So no, I don't think it would work for a directed graph.;94977
1904475;2010-01-01 00:23:56.477;1987495;0;I am not sure.  Someone with more C++ knowledge will hopefully answer that.  I didn't want to claim something I don't know for sure.  (Of course, I hope I got everything regarding C right in my reply - but if not, I will be happy to be corrected!);226621
1904476;2010-01-01 00:24:15.970;1987481;0;It seems that part is a bug. The same issue happens on this demo http://valums.com/wp-content/uploads/2009/10/editableText/demo/demo.htm;240609
1904477;2010-01-01 00:25:37.253;1978289;0;I specifically pointed out that I wasn't commenting on the current Jet version.  That the engine had well known problems with data integrity that I experienced first hand in a mature release (3.5 with all the SPs/patches) that is not that long ago is very relevant to the original post.  One data corruption problem is enough to sour you on an engine for life.  I've never seen a data corruption problem in Sql Server (caused by the engine).  While current Jet/ACE might be as solid as Sql Server, I wouldn't bet on it when you have Sql Server Express/Adp projects as a costless alternative.;240618
1904480;2010-01-01 00:28:01.267;1987573;0;He already explained that it's not normalised.;228936
1904481;2010-01-01 00:29:03.357;1987573;0;So I see, but that doesn't excuse it.;37213
1904482;2010-01-01 00:29:06.583;1987226;0;-removeAllObjects does work without calling -release.  Are you saying that is still a memory leak?;40106
1904483;2010-01-01 00:29:24.893;1967740;0;"public void onCreate(Bundle savedInstanceState) 
{
        super.onCreate(savedInstanceState);
        setContentView(R.layout.login_screen);
        emailTxt = (EditText) findViewById(R.id.email);
        emailTxt.setOnKeyListener(new OnKeyListener() 
 {

  public boolean onKey(View v, int keyCode, KeyEvent event) 

  {

   Log.i(""Key Value"", String.valueOf(keyCode));

  });
}";NULL
1904487;2010-01-01 00:32:02.953;1984733;0;Reading between the lines, we can conclude that the DBGrid is the source of this effect, interacting in some way with the TFields of the DataSet. I'm going to accept your answer on the basis of this conclusion. But I think we can still dig deeper. I want to know more about the precise mechanism that is responsible, as it may be the source of other little known side effects. Thanks, Dimitrij;84904
1904488;2010-01-01 00:32:15.043;1967740;0;I am just reading the keys for now.;NULL
1904489;2010-01-01 00:32:55.173;1987541;1;How is the marshalling code supposed to know when to marshal the union as `int[]` or `float[]` ? Is it supposed to choose for each array element, or is it always one or the other?;234815
1904490;2010-01-01 00:34:15.670;1987183;0;One last thing to point out: If you only let one end of the path wander, then a bad initial choice can condemn you never to find a solution. (Or at least to wander for a really long time. Learned that one the hard way!) So at some point you must switch to the other end of the path and let that end wander for a while. Or make sure you pick a good starting node.;94977
1904491;2010-01-01 00:34:38.067;1987495;0;@nobugz: Please see my edit.;226621
1904492;2010-01-01 00:34:45.840;1947611;0;O.k, I'm sort of an idiot...I decided to use Constants, and as I found out, they don't work like $_session...there in lies my idiocracy....constants are working like I wanted them to.  thanks for your help;249034
1904493;2010-01-01 00:34:55.740;1982071;0;I tried using TextWatcher but I need the KeyUp and KeyDown events for each key pressed. Textwatcher just gives me the keydown event.;NULL
1904494;2010-01-01 00:35:09.897;1987431;0;Thanks! I don't know why, but the download did not include any of the download sources.;572
1904495;2010-01-01 00:35:43.093;1987401;8;While `goto` may be dreaded, there are a small number of cases where it is actually useful and I believe this is one of them.;131407
1904496;2010-01-01 00:37:35.097;1986033;0;Perhaps use an additional variable, and then set it to 1 if you find a solution, 0 otherwise. Once you get out of the loop, you can check it, and do your stuff from there. I don't have my calculator on me, but I'm sure theres a `Break` command in list somewhere. Just stick that after the `Disp X` in the `If` statement.;NULL
1904497;2010-01-01 00:37:56.033;1987585;2;I'm fairly sure that doesn't work. Have you tested that?;143327
1904501;2010-01-01 00:40:04.020;1987585;4;"Definitely works. The ""right hand side"" of a lambda does not have to reference the ""left hand side"".";31668
1904502;2010-01-01 00:42:02.987;1987443;3;"While this is fine for most applications, there is an important difference between `switch` and `if/else` being that the compiler can usually optimize the ""branching"" operations by using a jump table, resulting in faster code.";131407
1904503;2010-01-01 00:43:48.240;1987397;0;Why? is the average level too slow or too high?;224363
1904504;2010-01-01 00:44:29.203;1987583;1;"solved no need of script 
i used error_reporting(0);";238952
1904505;2010-01-01 00:45:08.033;1987406;0;Than you, I was already thinking in using jQuery, but I wanted to start from the ground before getting into frameworks. :-);224363
1904506;2010-01-01 00:45:13.510;1987583;7;Safaali, you ought to fix the problems, not ignore then.;54680
1904507;2010-01-01 00:45:22.463;1987512;0;@bobince Excellent comment.;54420
1904508;2010-01-01 00:47:35.207;1987512;0;Although, this does *not* work in IE.;54420
1904510;2010-01-01 00:48:04.237;1987589;3;If i may, i think you are asking such simple questions, that maybe you should do some research before asking them on SO.;220819
1904511;2010-01-01 00:48:41.927;1986726;0;Here is the list of supported tags for Google docs. Note that not all of the unsupported tags cause XSS problems (some are just poorly supported by contenteditable): http://docs.google.com/support/bin/answer.py?hl=en&answer=146021;231675
1904512;2010-01-01 00:49:21.210;1987600;0;"In UIKit/Mobile Darwin, you can use properties as well: tf_text = yourTextField.text;";23498
1904513;2010-01-01 00:49:24.297;1865434;0;@David W. Fenton -- the issue was in the data type. I ended up rolling my own command builder to make this work.;50018
1904514;2010-01-01 00:49:30.913;1987602;2;You should make `ActionBase`'s destructor `virtual`. See http://www.parashift.com/c++-faq-lite/virtual-functions.html#faq-20.7;226621
1904515;2010-01-01 00:49:44.233;1986657;0;"Each class could derive from the same abstract base class that records the connections in one instance of a ""master"" class. It sounds like you need a ""Building"" class that has the canonical view of what's going on.";12960
1904516;2010-01-01 00:49:50.787;1987585;0;Well gee, would you look at that! That will clean up some of the Html.RenderPartial()s I've been using unnecessarily.;143327
1904517;2010-01-01 00:52:35.010;1987585;0;You're right, it does work.  I didn't think it would either.  Thanks.;9266
1904518;2010-01-01 00:53:23.213;1987585;6;"Keep in mind that lambdas are just method definition. A method can take a parameter ""x"" and not actually use it in the method body. A neat trick, for sure! I highly recommend reading Brad Wilson's 5-part series on templated helpers: http://bradwilson.typepad.com/blog/2009/10/aspnet-mvc-2-templates-part-1-introduction.html";31668
1904519;2010-01-01 00:54:28.017;1987609;0;Was just going to answer the same thing. great answer!;220819
1904520;2010-01-01 00:54:30.450;1987585;1;"I never realized that about lambdas; where have I been all this time?!";143327
1904521;2010-01-01 00:54:50.140;1987601;0;You will have to debug the PHP script or post it here. It's impossible to tell without.;187606
1904522;2010-01-01 00:55:06.953;1987612;0;It does look weird. Apparently, some code generators also use it. But I'm wondering if it's some convention for RMI, perhaps brought in from another language.;572
1904523;2010-01-01 00:55:22.507;1981765;0;This worked great thanks so much!;240487
1904524;2010-01-01 00:58:15.077;1987614;0;I'd have to check which classes it was in. This is in a school assignment, and the use of $ in variable names caught me off guard - I had forgotten it was even valid. If it was proxy classes, I could assume that they were probably generated.;572
1904525;2010-01-01 00:59:28.243;1987619;0;Does that still apply if developer is full-time paid to work with open-source technologies?  Such guy surely uses a lot of them in his projects, but isn't there anything differrent?;158676
1904526;2010-01-01 00:59:34.250;1987603;0;If you'd asked me, I'd have guessed that `$` was valid in class files, but not java source.;21234
1904528;2010-01-01 01:01:49.877;1987621;1;+1: Leave the presentation formatting to PHP;135152
1904529;2010-01-01 01:02:22.930;1987601;0;there are three PHP files, contact.php functions.php and config.php. They are all located in the root folder. They are too long to post here. Any other way?;121630
1904531;2010-01-01 01:03:55.297;1987629;0;Note that this is Python 2.x syntax.  Python 3.0 has print as a function, and redirection is done completely differently.;238406
1904532;2010-01-01 01:05:14.537;1987452;0;In this case I'm using them for hours.  They don't really need to be exact I just wondered why those seemingly simple numbers would result in a SUM so seemingly wrong.  Now I know :);32892
1904533;2010-01-01 01:05:38.023;1987397;0;For some people, far too low.;34397
1904534;2010-01-01 01:06:04.717;1987621;0;That's exactly how I do it in our Java/MySQL system. It works great.;18189
1904535;2010-01-01 01:06:19.747;1987480;0;Good explanation in simple terms.  Thanks!;32892
1904536;2010-01-01 01:06:44.310;1987300;0;"I would only want to use Part or HardDrive for finders, so I could do Part.all and then render views based on that, but that's not such a big loss.

I've tried using inheritance but as far as I can tell, I can't use ruby inheritance and have it use different tables for the subclasses. I initially designed this with STI as I said but there's a known bug in DM on their lighthouse page that prevents that.

What strategy would you use?";241445
1904537;2010-01-01 01:06:50.307;1986204;0;Is it churning out lots of debug SQL statements to the debug window? Try setting showSql to false when you configure the session factory.;83109
1904538;2010-01-01 01:07:46.087;1987625;0;ok, you might be on to something. THe working version has a PHP version of 5.2.11 and the non working version is 4.3.11. So Im guessing I have to call them to update it?;121630
1904539;2010-01-01 01:08:09.487;1987601;0;You can use a site like http://pastebin.ca to post the files and then link.;148870
1904540;2010-01-01 01:08:25.000;1987613;2;While you're very right in your advice, that doesn't have anything to do with the problem in subject.;158676
1904542;2010-01-01 01:08:57.527;1987532;0;global is notoriously evil. I'd redesign/refactor my system before I used global.;16668
1904543;2010-01-01 01:09:13.837;1930851;0;Is using QPersistantModelIndex the only sane way? The Qt MVC classes feel really outdated to me…;24587
1904544;2010-01-01 01:09:28.633;1987640;0;How can I make the switch in Coldfusion elegantly?;149080
1904546;2010-01-01 01:09:33.063;1987528;0;Folks are suggesting ways to do this, but why would you want to? This kind of pattern causes unmaintainable code. Consider refactoring.;16668
1904547;2010-01-01 01:10:16.550;1984901;3;"on many platforms, older perl's would have done better; starting in 5.10, usefaststdio (formerly the default on many platforms - which causes perl to try to interact in encapsulation-breaking ways with libc's FILE structs in the interest of blinding speed) defaults to off and the slower perlio abstraction layer replaces use of stdio.";17389
1904548;2010-01-01 01:11:38.693;1878803;0;@steveha: +1 - Named constants for function call: excellent use for function attributes.;140894
1904549;2010-01-01 01:11:49.697;1984901;2;"@steveha: I'm not seeing any comments that I'd label as sniping, except at oversimplified ""benchmarks"", regardless of language.";17389
1904550;2010-01-01 01:13:13.190;1983334;0;ok then i know. it is just to use common sense then. im using php:) a very easy to learn language..but the hardest part is to learn how to code the right structure:);206446
1904551;2010-01-01 01:13:32.713;1987640;0;"You could make the ""switch"" by keeping a variable that keeps track of the section you are on.  When that section no longer matches the ""LastSection"", create the next header.";55164
1904553;2010-01-01 01:14:37.423;1982562;0;Opening them to `/dev/null` is typical.;20713
1904554;2010-01-01 01:15:14.137;1987226;0;Yes.  The dictionary is being leaked.;25646
1904555;2010-01-01 01:15:58.293;1987640;0;Neil can you provide an example in CF that shows how that looping would work?;149080
1904557;2010-01-01 01:16:49.713;1984946;0;Will this be unique for a computer across the world?;238030
1904558;2010-01-01 01:17:33.627;1984946;0;And is it Mac-specific, or will the Windows version (`UuidCreateSequential()`) give the same result?;238030
1904559;2010-01-01 01:17:51.527;1987645;0;Can you show a code sample of what it is that you're doing and when the value switches between the two formats?;31668
1904560;2010-01-01 01:18:11.473;1986986;0;@Pavel - thanks for the explanation of the subtle mistake.  I've updated my example.;29809
1904561;2010-01-01 01:19:16.467;1987555;0;"This totally worked! The trick was the <textContent> property. It was the reason I had been getting blank outputs.

Thanks Josh. You rock";445584
1904562;2010-01-01 01:19:27.400;1987583;2;Safaali, seeing as you have a certain interest in PHP, do yourself a favour and look into fixing that script.;187606
1904563;2010-01-01 01:19:50.727;1987529;0;You should probably declare min_so_far as an int* or else pass the address of min_so_far when you make the function call. As it is, it'll probably compile but have major logic errors (and/or a segmentation fault).;129655
1904564;2010-01-01 01:19:59.863;1987613;0;"Thanks for the quick answer guys.  With a virtual destructor, this still compiles and executes with a ""pure virtual method called"" error with gcc-ubuntu-64 4.3.3.

The first produces the error, the next does not.  What is inherently different between the two?  The second takes the address of a temporary, which of course is not good.  Does the first also?

Button button = Button( Action<View>( view, &View::foo ) );

Action<View> action( view, &View::foo );
Button button2 = Button( action );";NULL
1904565;2010-01-01 01:20:19.427;1987485;0;"I agree that in principle this could be done, but it is rather more complicated in practice than your quick sketch would indicate. var not only requires that there be an initializer, it also requires that the initializer not refer to the variable. If you have int M(out int) then you can say ""int x = M(out x);"" but you cannot say ""var x = M(out x);"" because to do overload resolution on M, we need to know the type of x, which is what we're attempting to figure out. Would it be legal to say ""var s; if (b) M(out s); else s = 0;"" ?";88656
1904566;2010-01-01 01:20:24.157;1987532;0;Sure, but that wasn't the question.;228936
1904568;2010-01-01 01:21:43.090;1987589;0;Also, you should accept the answers that are correct.;220819
1904569;2010-01-01 01:22:23.420;1968581;0;Proxy class, or proxy server? It sounds like it might not be so easy in a shared hosting environment, right?;384670
1904571;2010-01-01 01:23:14.883;1984946;0;According to this: http://developer.apple.com/mac/library/documentation/CoreFoundation/Reference/CFUUIDRef/Reference/reference.html, the UUID is unique across time and space. I need it to be the same across time because I want to be able to use it at any time to uniquely identify a computer. How do I do this?;238030
1904572;2010-01-01 01:23:21.933;1987625;0;No, mail() should work on both of them.;187606
1904573;2010-01-01 01:23:22.777;1987460;0;"@Roger Pate: `a` is not a pointer to a static memory block, it is an array on the stack and it is initialized; therefore, yes this answer does apply.";3153
1904574;2010-01-01 01:23:29.530;1987641;0;Why was this downvoted?;55164
1904575;2010-01-01 01:23:30.093;1987238;0;This just gives (0,0) as before, unfortunately.;58635
1904577;2010-01-01 01:24:18.390;1982071;0;I don't think it's possible to listen to KeyUp and KeyDown from the software keyboard.;13070
1904578;2010-01-01 01:25:16.173;1987058;0;@BalusC - wow. Awesome answer. I can put that to good use myself.;181144
1904580;2010-01-01 01:26:07.703;1987613;0;Mike: The issue isn't taking the taking the address of a temporary, but using a reference after the lifetime has ended for the object to which it refers (see my answer).;NULL
1904581;2010-01-01 01:26:40.117;1987079;0;What I do (if I don't care about the jit time -- sometimes that is the thing that I am profiling since I often want to measure startup time), I simply run all my tests ten, a hundred, or whatever times and discard the first result.;88656
1904582;2010-01-01 01:26:47.387;1987647;0;"About undefined-ness... I checked the assembly, it seems that gcc didn't destroy `Action` hierarchy *at all*, if destructor was ""trivial""--i.e. compiler-generated.  So the code correctly caught vtable pointer without destructor since it remained in memory unoverwritten.";158676
1904584;2010-01-01 01:27:14.860;1985149;0;Thank you for the words!;137954
1904585;2010-01-01 01:27:29.930;1987573;0;"I'm still in the process of learning so maybe the next go around I'll learn the ""right way"" to do some of this stuff. ;)";172964
1904586;2010-01-01 01:30:09.083;1976193;0;I looked at your code. I think you should give each table (that will toggle 'selected' a common class like 'atBat' and target from there. I will edit my original post with my suggested code. Please let me know if it works.;230520
1904587;2010-01-01 01:30:16.260;1987561;0;Just what I needed. If I create the new file descriptor inside a function, will it still exist after the function ends?;25700
1904588;2010-01-01 01:31:10.610;1987119;0;Is DIR_EXCLUDES just `['.', '..']` or does it include other stuff?  Also, do you get the same time results the second time you run it?  Windows XP and beyond do some pretty freaky caching of filesystem info, and it can really affect benchmark results.;221537
1904589;2010-01-01 01:31:33.543;1987619;0;Ok. you seem to have covered it in your edit. (it's ok to remove this comment thread);158676
1904590;2010-01-01 01:32:18.393;1987615;0;It worked like a charm... just like what I wanted!! :) going to put this in a shell script for batch labelling... thanks a lot!;196863
1904592;2010-01-01 01:32:39.483;1987647;1;"There's no correctly catching this; it's undefined behavior and all bets are off *in the entire program* (as far as the standard guarantees).  What you found does make sense though, in the trivial-dtor case the vtable pointer isn't updated, so no error message.";NULL
1904594;2010-01-01 01:34:46.283;1987663;0;thanks seems I have to forget whole my code and turn to cURL :( :(;238952
1904596;2010-01-01 01:34:53.347;1987552;0;As always there is more than one way to anything with programing. Thanks everyone for your answers!;172964
1904598;2010-01-01 01:35:33.860;1987592;0;This seems to be the simplest way. Thanks;172964
1904600;2010-01-01 01:35:56.857;1987672;1;"How deep do you want to get into the mathematics? How ""CS"" should the answer be?";76337
