Id;CreationDate;PostId;Score;Text;UserId
1905259;2010-01-01 10:15:21.077;1988279;1;For info, if you had VS2008 you can still use LINQ-to-Objects with .NET 2.0 via LINQBridge: http://www.albahari.com/nutshell/linqbridge.aspx;23354
1905260;2010-01-01 10:15:51.107;1988241;0;+1: That's a nice way to solve it in Python. It saves having two almost identical regexps, and the performance hit of matching on the same string twice. But does .NET's Regex have an option to say where the match should start like Python or will this require copying strings, nullifying the performance advantage?;61974
1905261;2010-01-01 10:19:44.903;1988241;0;"""is then inside* a repetition.""  (You're entering regex-engine-specific territory.)";NULL
1905262;2010-01-01 10:21:17.257;1988279;0;Thank you for your resource.;215912
1905263;2010-01-01 10:21:32.700;1985491;8;Spring JDBC is vastly inferior to Ibatis. For one thing you either have to write row mappers (tedious) or Spring's bean mapping is incredibly slow. That doesn't matter if you're binding a form in Spring MVC but it sure does if you're returning thousands of rows. I cut down execution timeon a query from 50+ seconds to <2 just by replacing Spring's bean mapping in Spring JDBC with an explicit row mapper but who wants to write those?;18393
1905264;2010-01-01 10:23:04.663;1986886;0;John, I have no such reputation units to vote up. I'm new here, sorry.;220959
1905265;2010-01-01 10:24:19.013;1969954;0;I use DevExpress skins as well. They are great and have a nice editor if you are bold enough to start making your own skin.;69358
1905266;2010-01-01 10:26:05.977;1957528;0;What error does it give you?;340
1905267;2010-01-01 10:26:12.253;1987299;1;I'd be curious to see the same benchmark run with Perl using package variables instead.;2766176
1905268;2010-01-01 10:26:14.393;1988241;0;Mark: beats me---had this question been marked C# specific from the start I'd likely have refrained (but you seem to have that part covered well anyway).  Picking up where another regex stops is essential at times---you can apply a completely different expression, or try out various ones, at that point.;NULL
1905269;2010-01-01 10:26:22.107;1984825;0;thanks- I'll give that a go.... (and mark the question answered after that);2947
1905271;2010-01-01 10:27:31.457;1988301;0;unfortunately in IE6 it wont work I think;221213
1905272;2010-01-01 10:27:39.710;1988285;0;Hi Darin, Acturally, mainDict generated from a parsing result of XSD file. There is no keyword can be inserted to my code. i declared mainDict as a static dictionary<string, object> . I am afraid i can't foreach (KeyWord Content) as your suggestion. how to extend the StringBuilder loop method to meet my requirement? thank you.;215912
1905273;2010-01-01 10:29:13.700;1984871;2;With all benchmarks, report the versions of Perl and Python, note any odd compilation options (e.g. threaded or debugging perls may be slower), and report the hardware used so people can compare similar setups. Often in these cases, I will also try to run the benchmarks on a different operating system to see if it's really a problem with the stock interpreters. If you let someone else compile them for you, that might be the problem. :);2766176
1905274;2010-01-01 10:29:29.720;1988084;0;Why one down vote?;165520
1905275;2010-01-01 10:29:50.080;1975488;1;This would consider all nouns at the start of a sentence to be proper, though.  I really wish we changed our grammatical rules for things like this as they introduce ambiguity and don't have any function as far as I can tell beyond aesthetics.;53646
1905276;2010-01-01 10:31:47.287;1987895;0;wouldn't you rather use *unsigned* ints? It's not like age/month/.. can be negative.;128384
1905277;2010-01-01 10:32:07.940;1988278;0;"Thanks for the answer, however it does not fully answer my question. If I use this query, there will be old tags in the database. If you look at my example data in the question, I also need to delete the ""design"" tag from it. For the second question, I can't verify whether the tags box changed or not. How can I verify it? (It seems the only way is to request all the tags again before updating the row and compare them, which seems inefficient. I believe there should be a better solution for the all question.)";229335
1905278;2010-01-01 10:33:07.310;1988241;0;Thanks all of you! You really put a lot of effort into helping me!;241867
1905279;2010-01-01 10:34:01.177;1988111;2;I second that you can generate calls, I do it in my app.  It does nothing in simulator, so test it on actual device.;946
1905280;2010-01-01 10:34:29.563;1984634;0;i want to terminate the prosess on system2 by sending a OS call from system 1 how is it possible.;233572
1905281;2010-01-01 10:35:26.260;1988305;0;Hi thank you for your response. But can you tell me where can I add js file in my application? or how can i refference to the js file (which is in remote location);131564
1905282;2010-01-01 10:36:19.940;1988282;0;Agreed, but the question pertains to Arrays, and more specifically to extend Array verbs.;228259
1905283;2010-01-01 10:36:38.657;1979585;0;"I'll be reading the book soon - thanks for pointing it out. However this doesn't help with my testing needs ;)";87280
1905284;2010-01-01 10:37:51.170;1987679;0;@John: Regardless of what he may think or like, my understanding is that ISO guidelines require versioning of documents such as standards to be in base-10.;NULL
1905285;2010-01-01 10:38:08.267;1988285;0;See if update helps.;29407
1905286;2010-01-01 10:41:50.337;1988285;0;"sb.AppendFormat(""{0}/{1}/{2}/{3}, {4}"", - Can't using the fixed 4 variables. The items number will changed dynamical based on the mainDic layers. This means the mainDict generated dynamical and if the XSD file change, the mainDic must changed too. and the top code still could hande the dynamical condition.";215912
1905287;2010-01-01 10:43:10.927;1988317;2;Please don't write things like '//end if' and '//end for' at the end of blocks. It clutters the code and it isn't needed to understand what is going on. Plus it's not compile checked. Even if those comments are there I won't believe them without checking it for myself.;61974
1905288;2010-01-01 10:44:35.630;1988317;0;Can you give us the message of the exception? InvalidOperationException is widely used throughout the .NET Framework.;138578
1905289;2010-01-01 10:45:57.327;1988303;0;I am not using pthreads/win32. I am using windows native APIs.;236222
1905290;2010-01-01 10:46:50.280;1988280;1;This question really belongs on ServerFault.com;113141
1905291;2010-01-01 10:47:07.003;1988190;0;strlcpy is your friend. Google it.;49658
1905292;2010-01-01 10:47:10.590;1983016;1;@Norman: Let me put it this way: I don't number the limitations of the .bst language among the main defects of bibtex.  This is not to defend the .bst language as an example of how to design a concatenative language, where I defer to your superior knowledge.;222815
1905293;2010-01-01 10:47:51.837;1984920;8;"""On average, a garbage collector is far faster than manual memory management"" is misleading. It is faster than naive memory allocation, and far slower than optimised manual memory management. The problem is that nobody has the time to do the optimisations, and  programming in the optimised model is not much fun";35306
1905294;2010-01-01 10:48:55.873;173467;2;@David Arno: Client certificates, hardware tokens and OTPs to name a few.;20138
1905295;2010-01-01 10:49:55.797;1987187;0;@Derek: try putting the id #next in the A tag instead of the IMG tag.;210578
1905296;2010-01-01 10:50:51.817;1873410;0;+1: Strong list;239916
1905297;2010-01-01 10:50:52.300;1985471;0;@Christoph, I agree with you regarding use cases, especially because the original question really is about Arrays and nothing else. However it would still be nice as an added bonus to be able to reuse the function on other objects. Now regarding overloading, does `this.push || push` allow overloading by an intermediate class between this and Array? And, similar question, does `this.push.apply` allow overloading by an intermediate class? Finally, what is the benefit of the alternate version, wouldn't `this.push` always be faster than `this.push || push`?;228259
1905299;2010-01-01 10:51:29.207;1984884;0;VS is certainly not performance critical. Nobody buys a different compiler because they have to wait a bit longer for the build. Otherwise we'd be all using Delphi. They might buy a slower one because it optimises better, though.;35306
1905300;2010-01-01 10:52:02.190;1987529;0;"by safe do you mean thread safe ?
and why is it bad keeping state in my function ?";215769
1905301;2010-01-01 10:52:52.220;1987219;0;"note always , just the first time the function is called.

but i think i will use the INT_MAX ... thanks !";215769
1905302;2010-01-01 10:53:40.687;1987051;0;"You're welcome. I believe using natural log is better, it was just easier to explain using base 2. Let's clarify the cosine similarity:
TF/IDF is purely a representation: You convert a vector of word counts to a vector of TF/IDF values. The cosine similarity is the scalar multiplication between two normalized vectors; The vectors can be the original counts or transformed by TF/IDF. In the case as you stated it, the scalar multiplication will be zero because we either have words appearing in only one vector, or a common word with a zero score ('dog'). HTH.";1702
1905303;2010-01-01 10:54:15.693;1988305;0;In my example I used inline script, but you can also reference your js using using the `src` attribute: `<script type='text/javascript' src='http://mysite.com/userprofile.js'></script>`;29407
1905308;2010-01-01 10:56:19.603;1987025;0;ya i know there are errors in the code , ya i am pushing a pointer into the stack and poping an object not pointer, ya i can correct these errors , the main aim of posting this code was to explain you what i want to do. thanks for your comments because you are only one who answered this question.;238919
1905310;2010-01-01 10:57:38.027;1987567;0;But you _can_ guarantee execution order, using the priority argument of addEventListener(). Furthermore, while your manager suggestion is great, your comments about not saving overhead unless you also are able to abstract calculations is somewhat misleading, as it doesn't deal with the rather big cost of Event object instantiation.;229824
1905311;2010-01-01 11:00:04.433;1985471;0;Ignore my last question, the alternate version helps to use rotate on objects that do not implement `push` or `splice`. The 2 other questions are still valid although I could find the answer myself if I was not that lazy. I also like your answers (that's the drawback of providing good answers, people bother you with questions they could answer themselves).;228259
1905312;2010-01-01 11:00:31.390;1988346;5;"Try `printf(""yes\n"");` or `puts(""yes"");`.  You don't need `string.h`.";226621
1905313;2010-01-01 11:01:22.043;1986784;1;Starting with PHP 5.1, the real paths of includes and requires are cached by default. See http://prematureoptimization.org/blog/archives/33 - that still doesn't mean the OP should add all the folders to the include path though.;208809
1905315;2010-01-01 11:02:18.703;1983191;0;I have stepped through the validation but I don't see anything pertinent which could be due to the fact that I'm not checking the DropDownList in the validation.;241245
1905317;2010-01-01 11:06:12.017;1987219;0;"I don't know what you mean by ""note always"".  Assuming you meant ""not always"", what is that referring to?";226621
1905318;2010-01-01 11:08:12.387;1987627;0;Thanks. I'll give it a try.;116987
1905319;2010-01-01 11:10:32.273;1988305;0;Hi.. I'm sorry it is not working for me. I dont know wats the wrong with me. Even that alert msg also not coming..;131564
1905321;2010-01-01 11:11:23.537;1988190;0;I know about `strlcpy()`, but it's not ANSI/ISO C.  It's not even POSIX.;226621
1905322;2010-01-01 11:15:09.973;1988317;0;I'd guess from the code that it is 'Queue empty.';61974
1905323;2010-01-01 11:16:15.540;1988262;0;no problem. happy new year!;126039
1905324;2010-01-01 11:17:07.113;1988332;1;@Rilindo: this is brilliant!  modified two lines and I  was good to go.  thanks.;207725
1905325;2010-01-01 11:17:14.680;1987895;0;@greyfade: thanks for the correction!;226621
1905327;2010-01-01 11:17:30.030;1984884;0;Real-life performance much more depends on the libraries and frameworks you use, and there you mostly don't have a language choice.;35306
1905331;2010-01-01 11:19:07.390;1988361;4;"I think your camparer (comparator?) should take two arguments, this would simplify the case when the added value is inline and not in a variable you can access in your function.

array.pushIfNotExist({ name: ""tom"", text: ""tasty"" }, function(a,b){ return a.name === b.name && a.text === b.text; });";268
1905332;2010-01-01 11:19:10.150;1988340;0;+1 Second regex is better, no need to use lookaround, especially lookbehind, unless you need to, it's an efficiency killer!;220299
1905333;2010-01-01 11:19:20.043;1988358;1;there is definitly something wrong with your code, and i think you are mistaking views and controllers. Your task sounds trivial, but I think you are doing it wrong. Check out Movies tutorial from http://asp.net/mvc/;35954
1905335;2010-01-01 11:19:55.343;1988347;0;It's SO making it look like multiplying.It was `a**2...`.I've just corrected it.;198729
1905336;2010-01-01 11:21:25.050;1971464;0;I think GAE would work fine for this, and you could probably find an undirected graph solution. Could you give us a list of what functions you'd likely perform most?;78212
1905337;2010-01-01 11:22:37.540;1986381;1;"In your example, the current node is the Document Node. It's neither virtual nor abstract. It's the topmost node of the DOM and the parent of the catalog element. So the apply-templates instruction will select just the one and only ""catalog"" element.";42585
1905338;2010-01-01 11:23:42.450;1988268;19;Interesting technique but seems a little expensive as it will create a new class every time I use it in my code.;240656
1905339;2010-01-01 11:25:42.807;1985159;0;The goal isn't to make the fastest program. It's to compare similar programs doing similar things. Of course the programs are faster if you do less work. That doesn't help you compare the parts you cut out though. :);2766176
1905341;2010-01-01 11:26:54.333;1976681;0;"Thank you for your answer, but this is not what I was expected as an answer.  
I think I've questioned that ""if someone had integrated libsegfault.so and gdbserver"".  
I wanted a reason why this was not done yet, or a correct (adequate) integration between libsegfault.so and gdbserver.  
  
Sorry for my question for not being detailed enough, but the requirements are:  
1. Being able to plugin by LD_PRELOAD to any program
2. The program may be a multithreaded program
3. The program may link to a library that contain main function";239054
1905343;2010-01-01 11:27:08.230;1251789;0;"Could someone clarify, does inspect.getmembers() differ fundamentally from dir(), or is it just a convenient wrapper around dir (which the ""Note:"" in its documentation implies might be the case)?";91962
1905344;2010-01-01 11:28:08.353;1987535;0;Thanks that worked! I have chosen the inclusion tag, which works fine for this use-case.;237690
1905345;2010-01-01 11:28:40.843;1985257;0;All right! I just used the resource as if it was an ordinary string and wrote it into a temporary file. And everything workes fine, thank you again :);192957
1905347;2010-01-01 11:28:59.237;1986881;0;"Yes, in my example executable code lives in the .text section(s). they are concatenated together during linking. The offsets for functions are adjusted just like any other symbol. Although the .text offset might start at 0x1000, when all the .text sections are combined, the final size might be much larger than that.
If the code contains l = k+2, the object code that performs the operation willl have the addresses of l and k adjusted (because of the relocation records) to the final calculated values.";204046
1905348;2010-01-01 11:33:06.317;1985287;0;You can't really recommend the Cygwin behemoth just to allow command line builds.  That really is a sledgehammer to crack a nut - it has a place for porting Linux code to Windows but is otherwise ill-advised to use it for native Win32 development.  *All* compilers are command line tools whether driven from an IDE or not.;168986
1905349;2010-01-01 11:33:31.743;1988383;0;That's one possible and blatant fix...;39992
1905350;2010-01-01 11:34:06.687;1988203;0;Jikes RVM (formerly IBM Jalapeno) and Sun Lab's Maxine are two examples of self-hosting JVMs. The former has around 1000 lines of C. Java is usually compiled down to machine code.;4725
1905351;2010-01-01 11:34:36.920;1987783;0;unfortunately I have also tried the @ version before and it doesn't work at all. I have tried many ways to submit files to twitter, including using flash's URLLorder and flash's filereference's upload etc. Do you mind to make a real sample that really able to update the twitter background? Many many thanks.;63226
1905352;2010-01-01 11:34:39.450;1985284;0;@Christoph: Nothing stops you from using VC++ from the command line.  The build log from and IDE build even shows you what command-line was issued for each build step.;168986
1905353;2010-01-01 11:34:43.100;1985492;2;Never seen the http://iphoneonrails.com/ project so that's worth a green tick alone. Thanks!;125680
1905354;2010-01-01 11:35:30.193;1980257;0;Thanks! I think this should suffice.;22009
1905355;2010-01-01 11:35:54.610;1988389;0;There is a Try..Catch. Why I am not getting an exception alert?;194328
1905356;2010-01-01 11:36:27.090;1988346;0;ok i feel dumb. i missed yes, as Matt Greer pointed;192296
1905357;2010-01-01 11:38:19.583;1988383;0;or tell the webserver to handle HTML as PHP in the httpdconf;208809
1905358;2010-01-01 11:38:43.857;1988383;0;there isnt another fix, lol?!;161266
1905359;2010-01-01 11:39:11.580;1984863;1;In our case the mergeinfo was redundant. But you are right it will destroy ant partial merge info that you have done.;97627
1905360;2010-01-01 11:39:53.883;1988390;0;I removed the try..catch altogether and added error_reporting(E_ALL^E_NOTICE) on top.;194328
1905361;2010-01-01 11:40:10.653;1979092;0;oh my, somehow it seems that this got extremely complicated, I've spent quite some time figuring out how to enable analog loopback (alsa doesn't see it, even though it is seen under windows, whatever that means). I guess I'll have to find some other way. Thanks for the effort though.;96282
1905362;2010-01-01 11:41:17.630;1988320;0;just to add, theres nothing special about json. its just a javascript object initialization graph.. in your example you have an array (the square brackets), with objects in it (the curly bracket syntax).. you should check out object and array literals in javascript to reveal the 'magic';63751
1905363;2010-01-01 11:41:56.677;1985247;0;a great answer for many editors;149482
1905364;2010-01-01 11:42:51.293;1979293;4;This error doesn't just happen due to bugs in Microsoft controls. It also occurs when you make a programming error, and accidentally set a property to a invalid value. Something different on the user machines is causing the different behaviour - e.g. Windows themes or different configuration of the application.;15639
1905365;2010-01-01 11:43:31.323;1975941;0;and yet it was accepted as the answer, so I'm guessing it answered the question, or he did not actually test it.;267
1905366;2010-01-01 11:44:43.460;1988340;0;HI cletus, amazing thanks for your immediate response. thanks a lot.;84761
1905367;2010-01-01 11:45:40.680;1988377;0;Depends on how do you plan to find the appropriate coordinates of the cities on your jpg image;143972
1905368;2010-01-01 11:46:02.180;1988289;0;well i feel very conferrable with java, but i know its memory eater compared to php. but maybe i wrong and today java web is much better i dont know  i didnt do java web for long time ... but from what i remember its was pure fun (plain jsp and servlets no frameworks ).;63898
1905369;2010-01-01 11:47:28.377;1985280;0;"@Tom: DJGPP is not a Windows compiler; it is a DOS compiler with a 32bit DOS-extender. See: http://www.delorie.com/djgpp/v2faq/faq3_6.html";168986
1905370;2010-01-01 11:47:40.513;1876197;2;@Cameron.  That's not actually true.  A property with an empty getter and setter is a property not a field.  The compiler fills in the backing field behind the scenes.;9266
1905371;2010-01-01 11:47:54.430;1985284;1;"@Christoph The free ""Windows SDK"" from microsoft includes the 32 and 64 bit c/c++ compilers, you don't need VS of any form to use them";417292
1905372;2010-01-01 11:48:23.220;1986204;0;Or, do you have a slow logger like a database logger configured using log4net for debug output? This, combined with showSql=true, would slow your code down a fair bit as well.;83109
1905373;2010-01-01 11:48:32.527;1985471;0;Regarding the >>> operator, does it really improve performances considering that JS always converts back integers to double? This could result into length being converted to integer, shifted (not), then converted back to double, and finally used as a double later. This could decrease performances unless some JS implementation actually stores (unsigned) integers in variables. In which case one might think that such an implementation would store this.length as an integer and therefore >>> 0 would not improve anything. Also this.length would already be unsigned.;228259
1905374;2010-01-01 11:50:08.090;1985387;0;Upvoting this as most of the other comments seem to be suggesting gcc based compilers, which are fine, but it's just as possible to get the microsoft ones, and most examples etc. for the windows platform is targetted at those so it's probably easier in many ways;417292
1905375;2010-01-01 11:51:13.607;1972131;0;Thanks a lot. Adding weblogic-application.xml to my META-INF directory solves this problem.;49964
1905376;2010-01-01 11:52:23.720;1985267;0;As Chris has pointed out above, you will spend a lot of time in a debugger when you are trying to understand how a program is 'run'. A good IDE can actually help. What does *not* help is having some 'wizards' write your code for you. If you are writing all the code, the I don't think an IDE will impact your actual understanding.;165620
1905377;2010-01-01 11:53:07.643;1988413;0;Aha... Thought it has something to do with unicodes/ascii. Just copy/pasted example and forgot about that. Anyway - how to override automatic encoding?;82062
1905379;2010-01-01 11:53:28.113;1988394;0;Thank you, but that's more about coding standards rather than source deployment/build standards, I'm looking for documentation on how to get away from '.. well it runs on my machine ..'.;160966
1905380;2010-01-01 11:54:33.543;1986306;0;"Thanks. I just don't get it - how can I start a process and not stop it without a kill? Maybe I should look at Daemons spec.
I'll also check collectiveidea's fork.";116925
1905381;2010-01-01 11:55:44.133;1988391;1;Versions of IE tested?  Clearer description on how we might reproduce the problem would help.  Can you include a small example repro?;17516
1905382;2010-01-01 11:56:04.227;1851810;0;Any chance you could accept any answer? :);165132
1905383;2010-01-01 11:56:10.103;1988413;0;just set it to false and use the H() when you want to encode something;48387
1905385;2010-01-01 11:56:39.747;1988419;2;"Define ""unnacceptable""?";17516
1905386;2010-01-01 11:58:11.163;1988413;0;That i understood. It's acceptable solution. Just wondering - if i can keep it true and still render html with something like `NH()`. :);82062
1905388;2010-01-01 11:59:01.363;1988302;0;Show us the command line you are using.;2961
1905390;2010-01-01 12:00:27.693;1980179;0;"That sounds like an excellent work-around. At least its managed in a single location in this way. Ill try it out as soon as i have time to make sure it works correctly.

I would however still be interested in whether there is a fully automated solution.";240873
1905391;2010-01-01 12:01:00.940;1988340;0;"I tried like this:
instead of ""one"", my starting values is :/c/document_library/get_file?
end value is ( instead of two): 
&groupId=

Pattern p = Pattern.compile(""(\\b/c/document_library/get_file?uuid=\\b)(.*?)(\\b&groupId=\\b)""); 
Matcher m = p.matcher(content); 
List<String> matches = new ArrayList<String>(); 
List<String> result = new ArrayList<String>();
while (m.find()) { 
  matches.add(m.group()); 
} 
     
for(int z=0; z<matches.size(); z++) {
    result.add(matches.get(z));
}
     System.out.println(""result1 >>> = "" + matches.get(0));

But i am getting Index =0 ; size = 0....";84761
1905394;2010-01-01 12:02:11.530;1988413;0;O,  Don't know, I don't have spark install here so I can't check it. I just had the same bug I solved it with automaticEncoding=false, let me know if you find something...;48387
1905398;2010-01-01 12:03:46.363;1985552;0;"I'm glad this answer made it, I upvoted you Kevin ;-)";179341
1905399;2010-01-01 12:03:49.453;1985813;0;@Lasse V. Karlsen: Correct and fixed.;6212
1905401;2010-01-01 12:04:26.847;1988328;0;Interesting, but aside from the theme, i don't see the connection to programming. Also a very vague question...;117069
1905402;2010-01-01 12:04:42.977;1987983;2;"I'm not sure you realized, but the ""decorator"" package he's using does the same thing as the construct with ""wrapper"".  The only difference between your snippets is the order of applying the decorators in My_class.  You might clarify that in the answer to explain why it fixes things.";221537
1905403;2010-01-01 12:05:29.463;1874192;0;I'd give this +10 if I could. Saved me a lot of work trying to figure out why plugins wouldn't install properly.;5179
1905406;2010-01-01 12:07:19.323;1988305;2;After setting the DocumentText, you have to handle the DocumentCompleted event, and do the InvokeScript call(s) in the handler.;128240
